{
  "schema_version": "design-tokens/v1",
  "colors": {
    "surface": "#f4f4f0",
    "panel": "#ffffff",
    "panel_alt": "#e9e9e2",
    "text": "#111111",
    "muted": "#5f6368",
    "line": "#d7d7d2",
    "accent": "#0047ff",
    "accent_2": "#d7ff00"
  },
  "color_contract": {
    "schema_version": "design-color-contract/v1",
    "paradigm": "swiss-signal",
    "foundation": "light",
    "chroma_budget": "restrained",
    "primary_accent_roles": ["focus", "key-data"],
    "secondary_accent_mode": "marker-only",
    "semantic_exception_roles": [],
    "max_focal_hues": 1,
    "color_alone": false,
    "required_pairings": [
      { "foreground": "text", "background": "surface", "minimum_ratio": 7, "usage": "body-text" },
      { "foreground": "text", "background": "panel", "minimum_ratio": 7, "usage": "body-text" },
      { "foreground": "muted", "background": "surface", "minimum_ratio": 4.5, "usage": "supporting-text" },
      { "foreground": "muted", "background": "panel", "minimum_ratio": 4.5, "usage": "supporting-text" },
      { "foreground": "accent", "background": "surface", "minimum_ratio": 4.5, "usage": "interactive-text" },
      { "foreground": "text", "background": "accent_2", "minimum_ratio": 7, "usage": "inverse-text" }
    ]
  },
  "typography": {
    "display": "Inter, Helvetica, Arial, sans-serif",
    "body": "Inter, Helvetica, Arial, sans-serif",
    "mono": "JetBrains Mono, ui-monospace, SFMono-Regular, Menlo, monospace"
  },
  "spacing": {
    "page": "6vw",
    "section": "32px",
    "gap": "20px",
    "tight": "10px"
  },
  "radius": {
    "default": "0px"
  }
}
